{
  "schemaVersion": "0.1.0-oa",
  "claimEvaluationId": "clm:crit-confirmed-001",
  "claimType": "securite",
  "claimStatement": "No secrets stored in clear in Evidence records",
  "criticality": "critical",
  "evaluationMethod": "human_review",
  "requiredEvidenceRefs": [
    "ev:sensitive-001",
    "ev:external-001"
  ],
  "providedEvidenceRefs": [
    "ev:sensitive-001",
    "ev:external-001"
  ],
  "reviewBundleId": "rb:oa-under-001",
  "reviewBundleVersion": 2,
  "status": "pass",
  "proposedBy": {
    "actorId": "actor:studio",
    "role": "system",
    "displayName": "Studio",
    "authorityLevel": "none"
  },
  "reviewedBy": {
    "actorId": "actor:reviewer-1",
    "role": "reviewer",
    "displayName": "Reviewer One",
    "authorityLevel": "N2"
  },
  "confirmedBy": {
    "actorId": "actor:reviewer-1",
    "role": "reviewer",
    "displayName": "Reviewer One",
    "authorityLevel": "N2"
  },
  "confirmationAuthority": "authorized_human",
  "proposedAt": "2026-07-26T00:00:00.000Z",
  "evaluatedAt": "2026-07-26T01:00:00.000Z",
  "confirmedAt": "2026-07-26T02:00:00.000Z",
  "provenance": {
    "schemaVersion": "0.1.0-oa",
    "provenanceRecordId": "prv:clm-crit-001",
    "actor": {
      "actorId": "actor:reviewer-1",
      "role": "reviewer",
      "displayName": "Reviewer One",
      "authorityLevel": "N2"
    },
    "source": "review",
    "timestamp": "2026-07-26T00:00:00.000Z",
    "correlationId": "corr:oa-t-a6-001"
  }
}
